{
  "$schema": "http://json-schema.org/draft-07/schema#",
  "title": "Khusela verdict",
  "description": "Response of POST /check and return value of engine.evaluate(). Synthetic data only.",
  "type": "object",
  "required": ["check_id", "verdict", "reasons", "explanation", "explanation_source", "extracted", "expected", "ocr_confidence", "duplicate", "raw_ocr_text", "bank_reminder"],
  "properties": {
    "check_id": { "type": "string", "description": "Unique id of this check, e.g. chk_000123" },
    "verdict": { "enum": ["STOP", "WAIT", "MATCH"], "description": "Decided by the Python rules only. Never by the AI." },
    "reasons": {
      "type": "array",
      "description": "Why the verdict was reached. Empty array for MATCH.",
      "items": { "enum": ["duplicate_image", "duplicate_same_seller", "amount_mismatch", "recipient_mismatch", "reference_mismatch", "low_ocr_confidence", "field_not_found"] }
    },
    "explanation": { "type": "string", "description": "Two plain-English sentences for the seller. Always ends with the bank reminder idea." },
    "explanation_source": { "enum": ["template", "gemini"] },
    "extracted": {
      "type": "object",
      "description": "What OCR read from the screenshot. A field is null when OCR could not find it.",
      "required": ["amount", "recipient", "reference"],
      "properties": {
        "amount": { "type": ["number", "null"], "description": "Rands, e.g. 1800.00" },
        "recipient": { "type": ["string", "null"] },
        "reference": { "type": ["string", "null"] }
      }
    },
    "expected": {
      "type": "object",
      "description": "The sale the seller entered, plus the registered business name.",
      "required": ["amount", "recipient", "reference"],
      "properties": {
        "amount": { "type": "number" },
        "recipient": { "type": "string" },
        "reference": { "type": "string" }
      }
    },
    "ocr_confidence": { "type": "number", "minimum": 0, "maximum": 1 },
    "duplicate": {
      "type": "object",
      "required": ["found", "same_seller"],
      "properties": {
        "found": { "type": "boolean" },
        "same_seller": { "type": "boolean", "description": "true when the earlier image came from the same seller" }
      }
    },
    "raw_ocr_text": { "type": "string", "description": "Shown next to the verdict so the seller can check it by eye." },
    "bank_reminder": { "const": "Confirm the money in your banking app before you release goods." }
  }
}
