{
  "check_id": "chk_000002",
  "verdict": "WAIT",
  "reasons": [
    "recipient_mismatch"
  ],
  "explanation": "The amount matches, but the recipient name is incorrect. Do not release the goods; check your banking app first.",
  "explanation_source": "template",
  "extracted": {
    "amount": 1800.0,
    "recipient": "Sipho Mokoena",
    "reference": "SNK1800"
  },
  "expected": {
    "amount": 1800.0,
    "recipient": "Thabo Sneakers",
    "reference": "SNK1800"
  },
  "ocr_confidence": 0.91,
  "duplicate": {
    "found": false,
    "same_seller": false
  },
  "raw_ocr_text": "DEMO BANK\nPayment successful\nR1,800.00\nRecipient\nSipho Mokoena\nReference\nSNK1800",
  "bank_reminder": "Confirm the money in your banking app before you release goods."
}
